{
  "database_path": "data/processed/tube_geometry",
  "label": "All_and_One",
  "process_part": "movement",
  "annotation_json_path": "data/ml/machine-and-movement_complete.json",
  "experiment_ids_path": "data/ml/unique_bending_setups.csv",
  "model_path_root": "models/classifier",
  "eliminated_columns": [
    "PRESSURE-DIE_LEFT_AXIAL_Movement_[mm]",
    "COLLET_ROTATING_Movement_[mm]",
    "BEND-DIE_VERTICAL_Movement_[mm]",
    "PRESSURE-DIE_LATERAL_Movement_[mm]"
  ],
  "pipeline_config": {
    "dataloader_config": {
      "batch_size": 8
    },
    "model_config": {
      "hidden_size": 64,
      "num_layers": 2
    },
    "training_config": {
      "training": false,
      "num_epochs": 100,
      "learning_rate": 1e-3,
      "patience": 4
    }
  },
  "analytics":true,
  "show_result_properties":{
    "store_plots": true,
    "store_plots_path": "results/activity_recognition" 
  },
  "inference_one_label_in_one":{
    "models_path": "models/classifier",
    "save_dir_path": "results/activity_recognition", 
    "labels": [
      "Clamping",
      "Bending",
      "Mandrel Extraction",
      "De-Clamping"
    ]
  }
}
